{
  "schema": "game-observatory.ai-player.account-metric-definition.v1",
  "id": "metric-definition.sanguo.resource.food.v1",
  "game_id": "sanguo-mouding-tianxia",
  "metric_key": "sanguo.resource.food",
  "label": "粮食",
  "category": "resource",
  "unit": "count",
  "numeric_format": "integer",
  "improvement_direction": "higher_is_favorable",
  "minimum_value": 0,
  "maximum_value": 10000000000,
  "minimum_ocr_confidence": 0.95
}
