{
  "schema": "game-observatory.ai-player.account-metric-definition.v1",
  "id": "metric-definition.sanguo.account.prosperity.v1",
  "game_id": "sanguo-mouding-tianxia",
  "metric_key": "sanguo.account.prosperity",
  "label": "繁荣度",
  "category": "account_progression",
  "unit": "point",
  "numeric_format": "integer",
  "improvement_direction": "higher_is_favorable",
  "minimum_value": 0,
  "maximum_value": 100000000,
  "minimum_ocr_confidence": 0.95
}
