{
  "schema": "game-observatory.ai-player.account-metric-definition.v1",
  "id": "metric-definition.sanguo.action.till-remaining.v1",
  "game_id": "sanguo-mouding-tianxia",
  "metric_key": "sanguo.action.till_remaining",
  "label": "屯田剩余",
  "category": "objective",
  "unit": "count",
  "numeric_format": "integer",
  "improvement_direction": "lower_is_favorable",
  "minimum_value": 0,
  "maximum_value": 1000,
  "minimum_ocr_confidence": 0.95
}
